1,1,World Wide Web and satellite television are examples of mass media.,http://catalog.flatworldknowledge.com/bookhub/identify/none/3797?e=paletz_1.0-ch01_s01,True (Incorrect),False (Correct),,,,
1,2,"The Corporation for Public Broadcasting was created by the federal government in 1967 as a private, nonprofit corporation.",http://catalog.flatworldknowledge.com/bookhub/identify/none/3797?e=paletz_1.0-ch01_s01,True (Correct),FALSE,,,,
1,3,Which of the following is classified as mass media?,http://catalog.flatworldknowledge.com/bookhub/identify/none/3797?e=paletz_1.0-ch01_s01,Instant messenger (Incorrect),Blog,Cell phone,Network television (Correct),Governmental Website,
1,4,Which of the following statements is true of new media?,http://catalog.flatworldknowledge.com/bookhub/identify/none/3797?e=paletz_1.0-ch01_s01,They are designed to reach large audiences. (Incorrect),They are well-established communication patterns.,They are electronic forms of communication. (Correct),They lack the ability to be interactive.,They do not encourage democratic communication.,
1,5,Which of the following is a valid observation of the media industry in the United States?,http://catalog.flatworldknowledge.com/bookhub/identify/none/3797?e=paletz_1.0-ch01_s01,The industry is dominated by only a few companies. (Correct),The industry is characterized by the absence of multinational companies.,The industry is generally considered a not-for profit industry.,The industry is not regulated by a specific regulatory authority.,The industry is widely appreciated for its extensive coverage of government and public affairs.,
1,6,Which of the following was the core of the mass media of the departed twentieth century?,http://catalog.flatworldknowledge.com/bookhub/identify/none/3797?e=paletz_1.0-ch01_s01,Films (Incorrect),Commercial Radio,Books,Magazines,Newspaper (Correct),
1,7,"Institutions, organizations, and subjects that a reporter is assigned to cover regularly are called scoops.",http://catalog.flatworldknowledge.com/bookhub/identify/none/3797?e=paletz_1.0-ch01_s02,True (Incorrect),False (Correct),,,,
1,8,The mass media rely on the wire services wire services for much of their international and national news.,http://catalog.flatworldknowledge.com/bookhub/identify/none/3797?e=paletz_1.0-ch01_s02,True (Correct),FALSE,,,,
1,9,"Journalists are known as lap dogs when their news stories hold people in power accountable by scrutinizing and reporting their statements, activities, claimed accomplishments, and failures.",http://catalog.flatworldknowledge.com/bookhub/identify/none/3797?e=paletz_1.0-ch01_s02,True (Incorrect),False (Correct),,,,
1,10,Which of the following is the most accurate description of news?,http://catalog.flatworldknowledge.com/bookhub/identify/none/3797?e=paletz_1.0-ch01_s02,News refers to detailed descriptions of events happening across the world. (Incorrect),News is a collection of interrelated events.,News is a selective account of what happens in the world. (Correct),News refers to the unidirectional interpretation of the happenings in the world.,News is a chain of related events presented in an attractive manner.,
1,11,"Institutions, organizations, and subjects that a reporter is assigned to cover regularly are called _____.",http://catalog.flatworldknowledge.com/bookhub/identify/none/3797?e=paletz_1.0-ch01_s02,sources (Incorrect),objects,scoops,wires,beats (Correct),
1,12,Which of the following best describes sources?,http://catalog.flatworldknowledge.com/bookhub/identify/none/3797?e=paletz_1.0-ch01_s02,They are people who manipulate information. (Incorrect),They are people who provide information. (Correct),They are institutions that appoint journalists.,They are news obtained ahead of other reporters.,They are intermediaries between government and media.,
1,13,News that a reporter obtains ahead of others are called _____.,http://catalog.flatworldknowledge.com/bookhub/identify/none/3797?e=paletz_1.0-ch01_s02,scoops (Correct),wires,beats,leads,chains,
1,14,What are wire services?,http://catalog.flatworldknowledge.com/bookhub/identify/none/3797?e=paletz_1.0-ch01_s02,online media that publish news (Incorrect),agencies that transmit news internationally (Correct),media networks that cover only national news,electronic media that cover unidirectional news,media networks that cover only local news,
1,15,Spinning information refers to _____.,http://catalog.flatworldknowledge.com/bookhub/identify/none/3797?e=paletz_1.0-ch01_s02,collecting information from informal sources (Incorrect),reporting without investigating on issues,buying information from third parties for reporting,interpreting information to support one’s point of view (Correct),using information from a variety of sources when reporting,
1,16,Journalists are called _____ when the government’s perspective dominates their news stories.,http://catalog.flatworldknowledge.com/bookhub/identify/none/3797?e=paletz_1.0-ch01_s02,lap dogs (Correct),watchdogs,spin dogs,attack dogs,wired dogs,
1,17,"Journalists are known as _____ when their news stories hold people in power accountable by scrutinizing and reporting their statements, activities, claimed accomplishments, and failures.",http://catalog.flatworldknowledge.com/bookhub/identify/none/3797?e=paletz_1.0-ch01_s02,attack dogs (Incorrect),wired dogs,lap dogs,watchdogs (Correct),spin dogs,
1,18,Attack dogs are journalists whose stories are _____.,http://catalog.flatworldknowledge.com/bookhub/identify/none/3797?e=paletz_1.0-ch01_s02,representative of the government’s policies (Incorrect),highly negative about government and politics (Correct),intended to scrutinize famous individuals,used to promote the president and executives,intended to report specific behaviors of people,
1,19,The power of the media to tell the public what subjects and issues to think about is called agenda setting.,http://catalog.flatworldknowledge.com/bookhub/identify/none/3797?e=paletz_1.0-ch01_s03,True (Correct),FALSE,,,,
1,20,Which of the following refers to the media’s power to tell the public what subjects and issues to think about?,http://catalog.flatworldknowledge.com/bookhub/identify/none/3797?e=paletz_1.0-ch01_s03,Agenda setting power (Correct),Spinning power,Framing power,Indexing power,Investigative power,
1,21,Framing refers to media’s power to _____.,http://catalog.flatworldknowledge.com/bookhub/identify/none/3797?e=paletz_1.0-ch01_s03,present relevant information (Incorrect),tell people what to think about,present complete information,engage in lobbying to obtain scoops,influence how people are thinking (Correct),
1,22,"Media frames can provide criteria that audience members use to make judgments about government institutions, public officials, and issues. This is called _____.",http://catalog.flatworldknowledge.com/bookhub/identify/none/3797?e=paletz_1.0-ch01_s03,Scooping (Incorrect),Framing,Spinning,Priming (Correct),Agenda setting,
1,23,_____ refers to encouraging or inspiring individuals to engage in political behavior and action.,http://catalog.flatworldknowledge.com/bookhub/identify/none/3797?e=paletz_1.0-ch01_s03,Mobilizing (Correct),Priming,Spinning,Scooping,Agenda setting,
1,24,Narrowcasting refers to presenting individuals in bad light based on inadequate information.,http://catalog.flatworldknowledge.com/bookhub/identify/none/3797?e=paletz_1.0-ch01_s04,True (Incorrect),False (Correct),,,,
1,25,"Which of the following refer to online diaries whose authors post information, including ideas and opinions?",http://catalog.flatworldknowledge.com/bookhub/identify/none/3797?e=paletz_1.0-ch01_s04,Websites (Incorrect),iReports,Blogs (Correct),Wikileaks,Podcasts,
2,1,The Articles of Confederation were the first political constitution for the government of the United States.,http://catalog.flatworldknowledge.com/bookhub/identify/none/3797?e=paletz_1.0-ch02_s01,True (Correct),FALSE,,,,
2,2,What did the Declaration of Independence announce?,http://catalog.flatworldknowledge.com/bookhub/identify/none/3797?e=paletz_1.0-ch02_s01,Slavery and involuntary servitude are illegal throughout the United States. (Incorrect),Each of the thirteen colonies should refrain from taxing people.,The thirteen colonies in America are free of Britain. (Correct),Both men and women have the right to vote.,"U. S. citizens possess all the inherent rights of men, including the right to rebel against ""inadequate"" government.",
2,3,_____ were the first political constitution for the government of the United States.,http://catalog.flatworldknowledge.com/bookhub/identify/none/3797?e=paletz_1.0-ch02_s01,Voting rights amendments (Incorrect),Articles of Confederation (Correct),Party systems,Treaties of Alliance,Committees of the State,
2,4,Which of the following codified the Continental Congress’s practices and powers?,http://catalog.flatworldknowledge.com/bookhub/identify/none/3797?e=paletz_1.0-ch02_s01,Bill of Rights (Incorrect),Articles of Confederation (Correct),Treaty of Paris,Treaty of Alliance,Articles of Civil Rights,
2,5,Which of the following was a major drawback of the Articles of Confederation?,http://catalog.flatworldknowledge.com/bookhub/identify/none/3797?e=paletz_1.0-ch02_s01,The Articles denied the rights of individual states. (Incorrect),The Articles did not form a political constitution.,The Articles could not codify Congress’s practices and powers.,The Articles could not address serious foreign threats. (Correct),The Articles defined the confederation to be inferior to the individual states.,
2,6,The initial purpose of the Constitutional Convention was to outline a constitution that was radically different from the Articles of Confederation.,http://catalog.flatworldknowledge.com/bookhub/identify/none/3797?e=paletz_1.0-ch02_s02,True (Incorrect),False (Correct),,,,
2,7,The Virginia Plan enhanced the national government’s powers to levy taxes and regulate commerce but left remaining powers to the states.,http://catalog.flatworldknowledge.com/bookhub/identify/none/3797?e=paletz_1.0-ch02_s02,True (Incorrect),False (Correct),,,,
2,8,The three-fifths clause proposed that 60 percent of the enslaved population would be counted for purposes of representation.,http://catalog.flatworldknowledge.com/bookhub/identify/none/3797?e=paletz_1.0-ch02_s02,True (Correct),FALSE,,,,
2,9,Anti-federalists favored the ratification of the constitution crafted by the Constitutional Convention.,http://catalog.flatworldknowledge.com/bookhub/identify/none/3797?e=paletz_1.0-ch02_s02,True (Incorrect),False (Correct),,,,
2,10,What was the major purpose of the Constitutional Convention convened in 1787?,http://catalog.flatworldknowledge.com/bookhub/identify/none/3797?e=paletz_1.0-ch02_s02,To form a radical constitution for the United States of America (Incorrect),To increase states’ power over taxation,To introduce a powerful bill of rights,To amend the constitution of the United States,To propose limited reforms to the Articles of Confederation (Correct),
2,11,The delegates who attended the Constitutional Convention convened in 1787 were _____.,http://catalog.flatworldknowledge.com/bookhub/identify/none/3797?e=paletz_1.0-ch02_s02,well-educated property owners (Correct),representatives of the American people,representatives of various social classes in America,members of commoners such as farmers,representatives of the electoral college,
2,12,Who drafted the first working proposal for a Constitution in the Constitutional Convention?,http://catalog.flatworldknowledge.com/bookhub/identify/none/3797?e=paletz_1.0-ch02_s02,James Madison (Correct),Benjamin Franklin,George Washington,Hugh Williamson,John Dickinson,
2,13,Which of the following was a key cross-cutting divide that existed between states that participated in the Constitutional Convention?,http://catalog.flatworldknowledge.com/bookhub/identify/none/3797?e=paletz_1.0-ch02_s02,A few states sent more than twenty delegates whereas a few others sent less than three (Incorrect),Some states had sent black delegates whereas the others sent only whites,Some states were reliant on slavery whereas some others were not (Correct),A few states opposed the idea of having a central government and others supported it,A few states were ruled by men whereas the other states were ruled by women,
2,14,Which of the following was the key idea of the Virginia Plan?,http://catalog.flatworldknowledge.com/bookhub/identify/none/3797?e=paletz_1.0-ch02_s02,Independent existence of state and national governments (Incorrect),A strong national government that could veto any state laws (Correct),National government without economic powers but with military powers,National government powerful enough to levy taxes and regulate commerce but remaining powers with the states,Equal representation of states in a unicameral legislature,
2,15,The New Jersey Plan enhanced the national government’s powers to _____.,http://catalog.flatworldknowledge.com/bookhub/identify/none/3797?e=paletz_1.0-ch02_s02,control states’ affairs (Incorrect),be the supreme taxing authority,appoint state governments,regulate commerce (Correct),veto state laws,
2,16,Which of the following refers to the Connecticut Compromise?,http://catalog.flatworldknowledge.com/bookhub/identify/none/3797?e=paletz_1.0-ch02_s02,"In the senate, each state was proposed to be equally represented with two senators. (Correct)",Women were allowed to vote in states where their population was more than forty percent.,A certain percent of the enslaved population was proposed to be counted for the purposes of representation.,Two separate houses were formed for northern representatives and southern representatives.,The Constitutional Convention agreed on forming a unicameral (single-chamber) legislature.,
2,17,Which of the following statements describes the three-fifths clause proposed in the Constitutional Convention?,http://catalog.flatworldknowledge.com/bookhub/identify/none/3797?e=paletz_1.0-ch02_s02,At least 60 percent of women population would be counted for purposes of representation. (Incorrect),Women would be granted three-fifth of voting rights that men possess.,Three members would be elected from the southern states for every five members from the northern states.,Three members would be elected from the northern states for every five members from the southern states.,60 percent of the enslaved population would be counted for purposes of representation. (Correct),
2,18,The southern states supported the three-fifths clause because:,http://catalog.flatworldknowledge.com/bookhub/identify/none/3797?e=paletz_1.0-ch02_s02,they were larger than the northern states. (Incorrect),they were more populous than the northern states.,they had more women citizens than the northern states.,they supported the practice of slavery. (Correct),they were driven by service-based employment.,
2,19,A body of electors formed by the constitution and chosen by the states to select the president and vice president of the United States was called the _____.,http://catalog.flatworldknowledge.com/bookhub/identify/none/3797?e=paletz_1.0-ch02_s02,Constitutional Congress (Incorrect),Constitutional Senate,Electoral College (Correct),State Assembly,Electoral Council,
2,20,Federalists supported _____.,http://catalog.flatworldknowledge.com/bookhub/identify/none/3797?e=paletz_1.0-ch02_s02,localized rules for states (Incorrect),a strong national political system (Correct),state supremacy over national government,the Articles of Association,a federation of independent states,
2,21,Which of the following is a statement that an anti-federalist is most likely to oppose?,http://catalog.flatworldknowledge.com/bookhub/identify/none/3797?e=paletz_1.0-ch02_s02,United States should be a federation of independent states. (Incorrect),National government should have the power to levy taxes.,National government should have the power to veto state legislation. (Correct),Each state should have equal representation in the House of Representatives.,States should have the power to veto federal laws.,
2,22,"The Constitution is silent about various intermediary institutions such as political parties, interest groups, and the media.",http://catalog.flatworldknowledge.com/bookhub/identify/none/3797?e=paletz_1.0-ch02_s03,True (Correct),FALSE,,,,
2,23,Which of the following is a power that is assigned solely to the House of Representatives?,http://catalog.flatworldknowledge.com/bookhub/identify/none/3797?e=paletz_1.0-ch02_s03,Confirming executive appointments (Incorrect),Confirming treaties,Judicially reviewing the Constitution,Nominating Supreme Court justices,Bringing articles of impeachment (Correct),
2,24,What is the term assigned to the President of United States?,http://catalog.flatworldknowledge.com/bookhub/identify/none/3797?e=paletz_1.0-ch02_s03,2 years (Incorrect),3 years,4 years (Correct),5 years,6 years,
2,25,Which of the following is an example of an intermediary institution?,http://catalog.flatworldknowledge.com/bookhub/identify/none/3797?e=paletz_1.0-ch02_s03,The House of Representatives (Incorrect),The Senate,A Political party (Correct),The Supreme Court,The Federal Reserve,
2,26,The media rarely show the Constitution or the structure of the political system as a cause of political problems.,http://catalog.flatworldknowledge.com/bookhub/identify/none/3797?e=paletz_1.0-ch02_s04,True (Correct),FALSE,,,,
2,27,The official presentation of the Constitution in public buildings shows it as a(n) _____.,http://catalog.flatworldknowledge.com/bookhub/identify/none/3797?e=paletz_1.0-ch02_s04,book or rules (Incorrect),sacred document (Correct),obligatory framework,bulletin of information,rule book supplement,
2,28,Which of the following is a valid observation of the media’s approach toward the constitution of United States?,http://catalog.flatworldknowledge.com/bookhub/identify/none/3797?e=paletz_1.0-ch02_s04,Media have been highly critical of the constitution. (Incorrect),Media were critical of the inclusion of the Bill of Rights to the constitution.,"Media criticize the procedures established by the Constitution, not its structure.",Media present a rosy picture of the Constitution. (Correct),Media consider the constitution to be unfriendly with them.,
3,1,Regulating elections and establishing courts are exclusive powers of the Constitution.,http://catalog.flatworldknowledge.com/bookhub/identify/none/3797?e=paletz_1.0-ch03_s01,True (Incorrect),False (Correct),,,,
3,2,All the states have similar governmental structures to the national government.,http://catalog.flatworldknowledge.com/bookhub/identify/none/3797?e=paletz_1.0-ch03_s01,True (Correct),FALSE,,,,
3,3,Which of the following is an exclusive power given to the national government by the Constitution?,http://catalog.flatworldknowledge.com/bookhub/identify/none/3797?e=paletz_1.0-ch03_s01,Foreign relations (Correct),Regulating elections,Borrowing money,Policing powers,Establishing Courts,
3,4,"Which of the following powers awarded to the national government, by the Constitution, is a concurrent power?",http://catalog.flatworldknowledge.com/bookhub/identify/none/3797?e=paletz_1.0-ch03_s01,Establishing courts (Correct),Foreign relations,Issuing money,Maintaining an army,Trade across national and state borders,
3,5,Which of the following statements contradicts the commerce clause in the Constitution?,http://catalog.flatworldknowledge.com/bookhub/identify/none/3797?e=paletz_1.0-ch03_s01,National government has limited powers to regulate commerce among the States. (Correct),Most localities within the United States administer most of their own taxes.,Every state in the United States has its own tax administration.,National government has broad power to regulate Commerce with foreign nations.,The federal government has established a national highway system that traverses the states.,
3,6,The _____ clause in the Constitution allows the national government to claim logical extensions of the powers explicitly granted to it.,http://catalog.flatworldknowledge.com/bookhub/identify/none/3797?e=paletz_1.0-ch03_s01,necessary and proper (Correct),commerce,supremacy,due process,establishment,
3,7,Which of the following is a power that is reserved to the states?,http://catalog.flatworldknowledge.com/bookhub/identify/none/3797?e=paletz_1.0-ch03_s01,Ratifying proposed amendments to the Constitution (Correct),Regulating elections,Taxing people who reside within the state,Borrowing money from various institutions,Regulating trade across state borders,
3,8,"In a ruling, the Supreme Court held that state courts cannot issue rulings that contradict the decisions of federal courts. This ruling by the Supreme Court is based on the _____ clause of the Constitution.",http://catalog.flatworldknowledge.com/bookhub/identify/none/3797?e=paletz_1.0-ch03_s01,supremacy (Correct),due process,commerce,establishment,necessary and proper,
3,9,Which of the following is an aspect in which all fifty states are equal?,http://catalog.flatworldknowledge.com/bookhub/identify/none/3797?e=paletz_1.0-ch03_s01,Membership in the House of Representatives (Incorrect),Diversity of inhabitants,Levels of education,Size of population,Governmental structures to the national government (Correct),
3,10,Which of the following explains the states’ lack of automatic authority over tribe members on reservations within state borders?,http://catalog.flatworldknowledge.com/bookhub/identify/none/3797?e=paletz_1.0-ch03_s01,Constitution gives Congress and the national government exclusive power to regulate commerce with the Indian tribes. (Correct),Some tribal nations have been unable to establish their heritage and obtain federal recognition.,The United States Constitution prohibits discrimination on the basis of tribes by federal and state governments.,The Federal government has restricted the taxation of Native Americans within the United States.,Tribes cannot persuade investors to locate on reservations because of intense competition from non-Native American communities.,
3,11,"Competitive federalism is an approach to federalism that sees national, state, and local governments working together to address problems and implement public policies in numerous domains.",http://catalog.flatworldknowledge.com/bookhub/identify/none/3797?e=paletz_1.0-ch03_s02,True (Incorrect),False (Correct),,,,
3,12,Categorical grants require states to spend the funds for purposes specified by the Congress.,http://catalog.flatworldknowledge.com/bookhub/identify/none/3797?e=paletz_1.0-ch03_s02,True (Correct),FALSE,,,,
3,13,Mandates are directives from the national government to state and local governments.,http://catalog.flatworldknowledge.com/bookhub/identify/none/3797?e=paletz_1.0-ch03_s02,True (Correct),FALSE,,,,
3,14,Which of the following statements describes the states’ rights approach?,http://catalog.flatworldknowledge.com/bookhub/identify/none/3797?e=paletz_1.0-ch03_s02,States shall disobey laws if they consider them to be unconstitutional. (Correct),Powers have to be divided between national and state governments into distinct domains of authority.,"National, state, and local governments should work together to address problems and implement public policies.",States have the right to collect taxes and engage in policing to protect people.,Conflicts and compromise between national and state governments are essential for a republic.,
3,15,Which of the following statements is in favor of Republicans’ ideas that spread during early nineteenth century?,http://catalog.flatworldknowledge.com/bookhub/identify/none/3797?e=paletz_1.0-ch03_s02,A strong military is essential to support a growing economy. (Incorrect),Federal government should form all the laws of the land.,State governments should have the power to veto federal legislation. (Correct),Federal government should regulate the trade between states.,State governments should not interfere in Indian affairs.,
3,16,"In a crucial ruling, the Supreme Court struck down a Maryland state tax on the Bank of the United States chartered by the Congress. On what grounds did the Court take this decision?",http://catalog.flatworldknowledge.com/bookhub/identify/none/3797?e=paletz_1.0-ch03_s02,"When a state’s laws interfere with the national government’s operation, the latter takes precedence. (Correct)",Financial institutions such as banks should not be subject to regular taxation.,The bank was managed by Native Americans and the state didn’t have the authority to tax them.,The taxation led to discrimination against the bank.,The level of taxation was higher than usual.,
3,17,Which of the following statements describes the central concept of dual federalism?,http://catalog.flatworldknowledge.com/bookhub/identify/none/3797?e=paletz_1.0-ch03_s02,National government should be able to control the state governments. (Incorrect),The national government is the supreme authority in every aspect that concerns the nation.,National and state governments have clearly demarcated domains of power. (Correct),State government should have the power to veto legislations passed by the national government.,Legislative offices should be divided into two chambers.,
3,18,Which of the following clauses gives Congress the powers for economic regulation?,http://catalog.flatworldknowledge.com/bookhub/identify/none/3797?e=paletz_1.0-ch03_s02,The commerce clause (Correct),The due process clause,The free exercise clause,The establishment clause,The grandfather clause,
3,19,Grants-in-aid refer to the national government’s provision of funds to _____.,http://catalog.flatworldknowledge.com/bookhub/identify/none/3797?e=paletz_1.0-ch03_s02,the judiciary to implement laws (Incorrect),minority groups to improve their social status,states or localities to administer particular programs (Correct),various departments of the national government for public spending,people who excel in various fields,
