6,17,Political self refers to _____.,http://catalog.flatworldknowledge.com/bookhub/identify/none/3797?e=paletz_1.0-ch06_s02,a politician’s belief on his own abilities to perform the duties (Incorrect),the process through which politicians gain confidence,a sense of personal identification with the political world (Correct),the details of a person available to objective investigation by others,the ability of an individual to influence others’ perceptions,
6,18,"_____ is the process through which people develop the attitudes, values, beliefs, and opinions conducive to becoming good citizens in their country.",http://catalog.flatworldknowledge.com/bookhub/identify/none/3797?e=paletz_1.0-ch06_s02,Political socialization (Correct),Political learning,Political maturity,Political transformation,Political efficacy,
6,19,Which of the following terms refers the belief in the integrity of the political system and processes such as elections?,http://catalog.flatworldknowledge.com/bookhub/identify/none/3797?e=paletz_1.0-ch06_s02,Political self (Incorrect),Political efficacy,Political awareness,Political belief,Political legitimacy (Correct),
6,20,_____ refers to individuals’ feeling that they can or cannot personally influence government and politics.,http://catalog.flatworldknowledge.com/bookhub/identify/none/3797?e=paletz_1.0-ch06_s02,Political efficacy (Correct),Political belief,Political legitimacy,Political awareness,Political self,
6,21,Indoctrination forces people to _____.,http://catalog.flatworldknowledge.com/bookhub/identify/none/3797?e=paletz_1.0-ch06_s02,benefit from freedom (Incorrect),display creativity and passion,conform to the status quo (Correct),remain politically active,have high political efficacy,
6,22,Impressionable years refer to the period _____.,http://catalog.flatworldknowledge.com/bookhub/identify/none/3797?e=paletz_1.0-ch06_s02,from birth to late infancy (Incorrect),early infancy to late infancy,of early adulthood,of early childhood to teenage,from late adolescence to early adulthood (Correct),
6,23,Which of the following is a valid observation of a political generation?,http://catalog.flatworldknowledge.com/bookhub/identify/none/3797?e=paletz_1.0-ch06_s02,A political generation consists of people who are dissimilar in age. (Incorrect),A political generation develops shared political orientations. (Correct),Different individuals of a political generation experience different political socialization.,A political generation must have more than a million people.,A political generation always has clearly defined political beliefs.,
6,24,Which of the following is the major reason why Internet is a potentially powerful agent of political socialization?,http://catalog.flatworldknowledge.com/bookhub/identify/none/3797?e=paletz_1.0-ch06_s03,Many elections are conducted online. (Incorrect),Gallup polls and exit polls are conducted online.,Information about government is not available offline.,People actively engage with online platforms. (Correct),Internet is the most important medium to access older people.,
6,25,Benevolent leader is a concept in which young children consider the president to be a(n) _____.,http://catalog.flatworldknowledge.com/bookhub/identify/none/3797?e=paletz_1.0-ch06_s03,person responsible for the problems that exist in a nation (Incorrect),personal friend who will do good things for the nation. (Correct),authority who is supposed take care of their interests,person responsible for the national defense and related issues,authority who is supposed to govern the nation,
7,1,"A person’s opinions refer to his persistent, general orientations toward people, groups, or institutions.",http://catalog.flatworldknowledge.com/bookhub/identify/none/3797?e=paletz_1.0-ch07_s01,True (Incorrect),False (Correct),,,,
7,2,Which of the following terms refers to the people who closely notice government and politics in general?,http://catalog.flatworldknowledge.com/bookhub/identify/none/3797?e=paletz_1.0-ch07_s01,Issue public (Incorrect),Opinion public,Insistent public,Stationary public,Attentive public (Correct),
7,3,People who focus on particular public policy debates and ignore other topics are known as _____.,http://catalog.flatworldknowledge.com/bookhub/identify/none/3797?e=paletz_1.0-ch07_s01,opinion public (Incorrect),biased public,fractional public,issue public (Correct),attentive public,
7,4,"Which of the following terms refers to an individual’s persistent, general orientations toward people, groups, or institutions?",http://catalog.flatworldknowledge.com/bookhub/identify/none/3797?e=paletz_1.0-ch07_s01,Opinions (Incorrect),Ideas,Attitudes (Correct),Perceptions,Acquaintances,
7,5,Which of the following statements accurately describe pundits?,http://catalog.flatworldknowledge.com/bookhub/identify/none/3797?e=paletz_1.0-ch07_s01,They are people who manipulate information for their own gains. (Incorrect),They use information retrieved by others and are dependent on others.,They offer their opinion on political issues through the media. (Correct),They are people who are victimized during political conflicts.,They are individuals who depend on opinion leaders to take decisions.,
7,6,Public judgment is not easily achieved and offers an important counterbalance to the domination of elite opinion in the policy sphere.,http://catalog.flatworldknowledge.com/bookhub/identify/none/3797?e=paletz_1.0-ch07_s02,True (Correct),FALSE,,,,
7,7,Public judgment is a type of public opinion where people _____.,http://catalog.flatworldknowledge.com/bookhub/identify/none/3797?e=paletz_1.0-ch07_s02,express indistinct opinions of governmental actions and policies (Incorrect),conclude that the government is ineffective and try to find an alternative,spread positive opinions of a governmental policy and trigger its success,vigilantly consider the range of viewpoints and policy consequences of issues (Correct),use others’ judgments to arrive at a conclusion on issues,
7,8,_____ is a technique that provides members of the public with the opportunity to think carefully about issues and their relationship to public policy.,http://catalog.flatworldknowledge.com/bookhub/identify/none/3797?e=paletz_1.0-ch07_s02,Deliberative polling (Correct),Straw polling,Quick polling,Robo-Polling,Public opinion polling,
7,9,Straw poll is an informal poll that is administered haphazardly and without attention to proper sampling methods.,http://catalog.flatworldknowledge.com/bookhub/identify/none/3797?e=paletz_1.0-ch07_s03,True (Correct),FALSE,,,,
7,10,"Quick poll is an offline poll that is asked of a representative, self-selected sample of respondents.",http://catalog.flatworldknowledge.com/bookhub/identify/none/3797?e=paletz_1.0-ch07_s03,True (Incorrect),False (Correct),,,,
7,11,Closed-ended questions allow respondents to reply to a question in their own words.,http://catalog.flatworldknowledge.com/bookhub/identify/none/3797?e=paletz_1.0-ch07_s03,True (Incorrect),False (Correct),,,,
7,12,Quick polls do not conform to the established protocols for conducting scientific polls.,http://catalog.flatworldknowledge.com/bookhub/identify/none/3797?e=paletz_1.0-ch07_s03,True (Correct),FALSE,,,,
7,13,"_____ is an informal poll, often used to gauge opinions about candidates, that is administered haphazardly and without attention to proper sampling methods.",http://catalog.flatworldknowledge.com/bookhub/identify/none/3797?e=paletz_1.0-ch07_s03,Straw poll (Correct),Quick poll,Public opinion poll,Robo-poll,Push poll,
7,14,People are included in a quota sample _____.,http://catalog.flatworldknowledge.com/bookhub/identify/none/3797?e=paletz_1.0-ch07_s03,by using random selection techniques (Incorrect),based on demographic categories (Correct),by using independent observations from the population,by assuring equal chance for everyone,based on the rule of independent sampling,
7,15,_____ is a method of selecting survey participants at random.,http://catalog.flatworldknowledge.com/bookhub/identify/none/3797?e=paletz_1.0-ch07_s03,Convenient sampling (Incorrect),Judgmental sampling,Acceptance sampling,Cluster sampling,Probability sampling (Correct),
7,16,Which of the following statements best describes quick polls?,http://catalog.flatworldknowledge.com/bookhub/identify/none/3797?e=paletz_1.0-ch07_s03,They are offline surveys. (Incorrect),They have one or two questions. (Correct),They are representative samples.,They use random sampling techniques.,They use unwilling individuals to answer the questionnaire.,
7,17,Which of the following is an example of an open-ended question?,http://catalog.flatworldknowledge.com/bookhub/identify/none/3797?e=paletz_1.0-ch07_s03,Choose the number of times you visited this shop before. (Incorrect),Choose the product that you liked the most.,How often do you visit a shopping mall in a week?,Describe your shopping experience with us. (Correct),Identify the product that you disliked the most.,
7,18,_____ refers to a questionnaire typically administered by academic or government researchers to a representative sample people drawn from a larger population.,http://catalog.flatworldknowledge.com/bookhub/identify/none/3797?e=paletz_1.0-ch07_s03,Index (Incorrect),Survey (Correct),Directory,Quota,Sample,
7,19,Which of the following is conducted by phone using a recorded voice to ask the question and requiring respondents to answer by pressing the touch pad on their telephones?,http://catalog.flatworldknowledge.com/bookhub/identify/none/3797?e=paletz_1.0-ch07_s03,Push polling (Incorrect),Digital polling,Gallup polling,Exit polling,Robo-polling (Correct),
7,20,Which of the following is a valid observation about convenience sampling?,http://catalog.flatworldknowledge.com/bookhub/identify/none/3797?e=paletz_1.0-ch07_s03,It is a scientific method of sampling. (Incorrect),It is not used to conduct quick polls.,Respondents to the sampling are self-selected. (Correct),It is a sampling technique used to obtain indiscriminate samples.,It is the most preferred sampling method in large researches.,
7,21,Which of the following polls is not a legitimate poll and is designed to influence respondents’ opinions about candidates and issues through leading questions?,http://catalog.flatworldknowledge.com/bookhub/identify/none/3797?e=paletz_1.0-ch07_s03,Digital poll (Incorrect),Exit poll,Push poll (Correct),Gallup poll,Robo poll,
7,22,Which of the following is a valid observation about focus groups?,http://catalog.flatworldknowledge.com/bookhub/identify/none/3797?e=paletz_1.0-ch07_s03,They are not useful in understanding the group dynamics behind public opinion. (Incorrect),They can reveal when people are influenced by the opinions of others. (Correct),They function without facilitators or mediators.,They are not used in intense campaigns such as election campaigns.,They involve observation and do not require any involvement from the researcher.,
7,23,An opinion leader is a broker who imparts information about politics and government to other people.,http://catalog.flatworldknowledge.com/bookhub/identify/none/3797?e=paletz_1.0-ch07_s04,True (Correct),FALSE,,,,
7,24,Which of the following terms refers to a broker who imparts information about politics and government to other people?,http://catalog.flatworldknowledge.com/bookhub/identify/none/3797?e=paletz_1.0-ch07_s04,Opinion leader (Correct),Gatekeeper,Evaluator,Information seeker,Harmonizer,
7,25,Echo chamber refers to the _____.,http://catalog.flatworldknowledge.com/bookhub/identify/none/3797?e=paletz_1.0-ch07_s04,idea that people pay attention to media that conforms to their ideological views (Correct),idea that researches conducted in an assembly hall will be biased,biased information received during a research,the conclusions obtained from a focus group discussion,the hollowness of the information obtained from a research,
8,1,Voting to elect representatives is a support activity of political involvement.,http://catalog.flatworldknowledge.com/bookhub/identify/none/3797?e=paletz_1.0-ch08_s01,True (Incorrect),False (Correct),,,,
8,2,Symbolic participation refers to habitual acts that show support for or dissatisfaction with the political system.,http://catalog.flatworldknowledge.com/bookhub/identify/none/3797?e=paletz_1.0-ch08_s01,True (Correct),FALSE,,,,
8,3,Civil society is dependent on social networks that form between friends and associates.,http://catalog.flatworldknowledge.com/bookhub/identify/none/3797?e=paletz_1.0-ch08_s01,True (Correct),FALSE,,,,
8,4,_____ refers to the actions that are directed explicitly toward influencing the distribution of social goods and values.,http://catalog.flatworldknowledge.com/bookhub/identify/none/3797?e=paletz_1.0-ch08_s01,Political learning (Incorrect),Political socialization,Political support,Political participation (Correct),Political involvement,
8,5,Which of the following actions is a support activity in politics?,http://catalog.flatworldknowledge.com/bookhub/identify/none/3797?e=paletz_1.0-ch08_s01,Organizing a political campaign to support women (Incorrect),Contesting an election for membership in the House of Representatives,Working as a lobbying agent,Voting in an election,Participating in events associated with social causes (Correct),
8,6,Which of the following is an example of symbolic participation in politics?,http://catalog.flatworldknowledge.com/bookhub/identify/none/3797?e=paletz_1.0-ch08_s01,Obtaining membership of a political party (Incorrect),Saluting national flag daily in office (Correct),Voting in elections,Contesting elections,Participating in events associated with causes,
8,7,Which of the following is a necessary qualification for voting in the United States?,http://catalog.flatworldknowledge.com/bookhub/identify/none/3797?e=paletz_1.0-ch08_s01,The voter must have stayed in the United States for more than ten years. (Incorrect),The voter should have completed 21 years of age.,The voter should fulfill the residency requirements of the state. (Correct),The voter should have obtained a letter of consent from his parents.,The voter should own property within the United States.,
8,8,"During the civil rights movement, African Americans sat in whites-only sections of public busses. This act of disobedience is an example of a(n) _____.",http://catalog.flatworldknowledge.com/bookhub/identify/none/3797?e=paletz_1.0-ch08_s01,protest (Correct),domestic campaign,legal strike,mutiny,passive strike,
8,9,Political efficacy refers to the responsibility of a citizen to take part in community life.,http://catalog.flatworldknowledge.com/bookhub/identify/none/3797?e=paletz_1.0-ch08_s02,True (Incorrect),False (Correct),,,,
8,10,Political socialization refers to the _____.,http://catalog.flatworldknowledge.com/bookhub/identify/none/3797?e=paletz_1.0-ch08_s02,responsibility of a citizen to take part in community life (Incorrect),"active and passive, formal and informal ways in which people mature politically","process by which people acquire their political beliefs, attitudes, and actions (Correct)",process of imparting political orientation through external agents,process of losing faith in the integrity of the political system and processes,
8,11,Which of the following terms refers to the responsibility of a citizen to take part in community life?,http://catalog.flatworldknowledge.com/bookhub/identify/none/3797?e=paletz_1.0-ch08_s02,Political legitimacy (Incorrect),Political learning,Rule of law,Political efficacy,Civic duty (Correct),
8,12,An individual believes that he can make a difference to politics. This shows a strong sense of _____.,http://catalog.flatworldknowledge.com/bookhub/identify/none/3797?e=paletz_1.0-ch08_s02,political legitimacy (Incorrect),civic Duty,rule of law,political efficacy (Correct),social learning,
8,13,People between the ages of thirty-five and sixty-five are usually the most politically active.,http://catalog.flatworldknowledge.com/bookhub/identify/none/3797?e=paletz_1.0-ch08_s03,True (Correct),FALSE,,,,
8,14,Which of the following is the reason for the strong impact that education has on political participation?,http://catalog.flatworldknowledge.com/bookhub/identify/none/3797?e=paletz_1.0-ch08_s03,Most political campaigns are targeted at students. (Incorrect),Women are more educated than the men.,Education provides people with background knowledge. (Correct),Most of the students are in their impressionable years.,The population is comprised of more educated people than uneducated.,
8,15,What was the underlying purpose of introducing literacy tests for voting in the United States?,http://catalog.flatworldknowledge.com/bookhub/identify/none/3797?e=paletz_1.0-ch08_s03,Denying blacks the right to vote (Correct),Reducing the economic divide in the nation,Uplifting the minorities,Enhancing democratic activities,Increasing literacy within the United States,
8,16,Poll taxes refer to _____.,http://catalog.flatworldknowledge.com/bookhub/identify/none/3797?e=paletz_1.0-ch08_s03,tax imposed on people who do not participate in important polls (Incorrect),the fees paid by the state governments to national government to conduct polls,the portion of income tax revenue used to conduct elections,the fees that had to be paid before a citizen could register to vote (Correct),the fraction of total revenue used by governments to conduct polls,
8,17,A social movement will not have a formal and enduring organizational structure.,http://catalog.flatworldknowledge.com/bookhub/identify/none/3797?e=paletz_1.0-ch08_s04,True (Incorrect),False (Correct),,,,
8,18,Which of the following statements is true of social movements?,http://catalog.flatworldknowledge.com/bookhub/identify/none/3797?e=paletz_1.0-ch08_s04,A social movement has a formal and enduring organizational structure. (Correct),Social movements lack communication networks.,A social movement will not have recognized leaders.,Social movements will comprise people with dissimilar problems.,Movement participants assume that collective action could be detrimental.,
8,19,The abolitionist movement of the mid-1800s sought to:,http://catalog.flatworldknowledge.com/bookhub/identify/none/3797?e=paletz_1.0-ch08_s04,empower American Indians. (Incorrect),end slavery. (Correct),protect the right to religion.,empower women.,enact the supremacy clause.,
8,20,Minority citizens were not truly enfranchised until the passage of the _____.,http://catalog.flatworldknowledge.com/bookhub/identify/none/3797?e=paletz_1.0-ch08_s04,Americans with Disabilities Act of 1990 (Incorrect),Educational Equity Act of 1974,Uniform Exemptions Act of 1976,Judiciary Act of 1802,Civil Rights Act of 1964 (Correct),
8,21,What was the initial goal of the women’s movement?,http://catalog.flatworldknowledge.com/bookhub/identify/none/3797?e=paletz_1.0-ch08_s04,Obtaining equal job opportunities (Incorrect),Seeking affirmation action in favor of women,Seeking women’s suffrage (Correct),Obtaining better social security,Seeking educational opportunities as men,
8,22,The Americans with Disabilities Act guarantees that _____.,http://catalog.flatworldknowledge.com/bookhub/identify/none/3797?e=paletz_1.0-ch08_s04,handicapped individuals will be given equal rights for employment in all types of private and public jobs (Incorrect),no individual will be excluded from the benefits of any program that received public funding because of a handicap (Correct),disabled individuals will be given equal rights for employment in all types of public jobs,the physically disabled citizens of the United States will be given preference over other candidates for public-sector jobs,a certain percentage of all public sector jobs will be reserved for disabled individuals.,
8,23,Spiral of cynicism refers to a cycle of distrust of government and politics created by the media’s scandal-ridden coverage of government and politics.,http://catalog.flatworldknowledge.com/bookhub/identify/none/3797?e=paletz_1.0-ch08_s05,True (Correct),FALSE,,,,
8,24,A virtuous circle refers to the _____.,http://catalog.flatworldknowledge.com/bookhub/identify/none/3797?e=paletz_1.0-ch08_s05,people who occupy governmental positions and powers (Incorrect),political interest and engagement stimulated by the media (Correct),group of individuals who actively participate in politics,wealthy individuals who control politics without any direct involvement,overall benefits of belonging to the united states,
8,25,Which of the following statements describes the concept of bowl alone?,http://catalog.flatworldknowledge.com/bookhub/identify/none/3797?e=paletz_1.0-ch08_s05,Television is making Americans a nation of watchers rather than doers. (Correct),Presence of powerful media is beneficial for a nation’s growth.,Government should not use media to promote its activities.,Printed media is more significant in influencing people than other media.,Traditional media is more powerful than modern media in communicating public policies.,
9,1,People who earn an income by running interest groups are called interest group entrepreneurs.,http://catalog.flatworldknowledge.com/bookhub/identify/none/3797?e=paletz_1.0-ch09_s01,True (Incorrect),False (Correct),,,,
9,2,Free-rider problem refers to a situation in which people can benefit from an interest group’s accomplishments without joining it.,http://catalog.flatworldknowledge.com/bookhub/identify/none/3797?e=paletz_1.0-ch09_s01,True (Correct),FALSE,,,,
9,3,Interest groups use political action committees as a means to raise funds and contribute to candidates in federal elections.,http://catalog.flatworldknowledge.com/bookhub/identify/none/3797?e=paletz_1.0-ch09_s01,True (Correct),FALSE,,,,
9,4,Interest groups _____.,http://catalog.flatworldknowledge.com/bookhub/identify/none/3797?e=paletz_1.0-ch09_s01,are intermediaries linking people to government (Correct),contribute to social welfare and earn income at the same time,are organizations that distribute surplus funds to owners or shareholders,are required to have a significant investment by the government,contribute a significant part of their funds to the government,
9,5,Labor unions and trade associations are examples of _____ interest groups.,http://catalog.flatworldknowledge.com/bookhub/identify/none/3797?e=paletz_1.0-ch09_s01,societal (Incorrect),ideological,public,government,economic (Correct),
9,6,"_____ interest groups work for widely accepted concepts of the common good, such as the family, human rights, and consumers.",http://catalog.flatworldknowledge.com/bookhub/identify/none/3797?e=paletz_1.0-ch09_s01,Economic (Incorrect),Societal,Ideological,Public (Correct),Government,
9,7,Interest group entrepreneurs are _____.,http://catalog.flatworldknowledge.com/bookhub/identify/none/3797?e=paletz_1.0-ch09_s01,entrepreneurs who engage in social welfare activities (Incorrect),people who see the need for and create an interest group (Correct),large businesses that act in a way that is beneficial to the society,businesses that promote activities of national interest,people who donate funds to societal and ideological interest groups,
9,8,Free-rider problem is a situation in which people _____.,http://catalog.flatworldknowledge.com/bookhub/identify/none/3797?e=paletz_1.0-ch09_s01,can benefit from an interest group’s accomplishments without joining it (Correct),have to be paid in order to join an interest group,hesitate to join an interest whose membership is open to everyone,expect special benefits and offers from established interest groups.,governing the interest groups abstain from paying membership fees and enjoy a free ride.,
9,9,A(n) _____ incentive leads people voluntarily to join and contribute money to a group because they want to help the group achieve its goals.,http://catalog.flatworldknowledge.com/bookhub/identify/none/3797?e=paletz_1.0-ch09_s01,purposive (Correct),solidary,acquaintance,material,financial,
9,10,The Institute of Electrical and Electronics Engineers (IEEE) is a professional association dedicated to advancing technological innovation related to electricity. Many young professionals join this organization with hopes of interacting with likeminded individuals. Which of the following kind of incentives is attracting these young professionals?,http://catalog.flatworldknowledge.com/bookhub/identify/none/3797?e=paletz_1.0-ch09_s01,Purposive (Incorrect),Authoritative,Solidary (Correct),Material,Financial,
9,11,Which of the following is the major purpose of political action committees formed by interest groups?,http://catalog.flatworldknowledge.com/bookhub/identify/none/3797?e=paletz_1.0-ch09_s01,Using political influence to initiate actions that are beneficial to the group (Incorrect),Raising funds for socially beneficial campaigns,Generating funds for the functioning of the group,Generating profit for the members of the group,Raising funds and contributing to candidates in elections (Correct),
9,12,Grassroots lobbying refers to the policy of influencing policy decisions through legal proceedings.,http://catalog.flatworldknowledge.com/bookhub/identify/none/3797?e=paletz_1.0-ch09_s02,True (Incorrect),False (Correct),,,,
9,13,_____ are representatives of interest groups who try to influence public officials.,http://catalog.flatworldknowledge.com/bookhub/identify/none/3797?e=paletz_1.0-ch09_s02,Activists (Incorrect),Pundits,Lobbyists (Correct),Affiliates,Associates,
9,14,Lobbyists need access to policymakers in order to make their cases. Access in this case refers to the opportunity to _____.,http://catalog.flatworldknowledge.com/bookhub/identify/none/3797?e=paletz_1.0-ch09_s02,meet with and communicate with policymakers. (Correct),be a part of the policymaking committee,avail all the information that the policymakers have access to,have the policymakers obligated to share information with them,illegitimate contacts with the policymakers,
