12,2,Bills for tax and spending cannot be _____.,http://catalog.flatworldknowledge.com/bookhub/identify/none/3797?e=paletz_1.0-ch12_s01,amended by the House of Representatives (Incorrect),amended by the Senate,initiated by the House of Representatives,rejected by the Senate,initiated by the Senate (Correct),
12,3,The sixteenth amendment to the Constitution provides Congress the power to _____.,http://catalog.flatworldknowledge.com/bookhub/identify/none/3797?e=paletz_1.0-ch12_s01,appoint the Chief Justice of the of the United States (Incorrect),borrow money on the credit of the United States,declare war and make rules concerning captures of land and water,coin money and regulate the value thereof,levy an income tax without apportioning it among the states (Correct),
12,4,Which of the following refers to the constitutional provision that Congress shall make all laws that are necessary and proper for executing their powers?,http://catalog.flatworldknowledge.com/bookhub/identify/none/3797?e=paletz_1.0-ch12_s01,Elastic clause (Correct),Supremacy clause,Due process clause,Establishment clause,Commerce clause,
12,5,A state’s representation in the House of Representatives is based on the total area of the state.,http://catalog.flatworldknowledge.com/bookhub/identify/none/3797?e=paletz_1.0-ch12_s02,True (Incorrect),False (Correct),,,,
12,6,Why did the founders of the Constitution establish Congress as a bicameral legislature?,http://catalog.flatworldknowledge.com/bookhub/identify/none/3797?e=paletz_1.0-ch12_s02,In order to prevent possible tyranny (Correct),In order to limit the powers of the President,In order to limit the taxation powers of the state governments,In order to strengthen the judicial branch,In order to strengthen the executive branch,
12,7,A politician is usually called a carpetbagger if he or she _____.,http://catalog.flatworldknowledge.com/bookhub/identify/none/3797?e=paletz_1.0-ch12_s02,has run for office from the same constituency more than two times (Incorrect),was not born and brought un in the United States of America,has used his or her influence to achieve personal benefits,runs for office from an area where he or she has lived for only a short time (Correct),has favored his supporters to obtain benefits such as government employment.,
12,8,The House of Representatives is designed to be the most democratic institutional body. Which of the following is the basis of this view?,http://catalog.flatworldknowledge.com/bookhub/identify/none/3797?e=paletz_1.0-ch12_s02,The House of Representatives has more members than the senate. (Incorrect),The Senate cannot reject the bills initiated by the House of Representatives.,The members of the House are selected directly by the members of the state legislature.,Each member of the House represents a particular district within a state rather than the entire state. (Correct),States would not lose representatives from the House due to population shifts.,
12,9,Why has fundraising become a constant concern for many senators?,http://catalog.flatworldknowledge.com/bookhub/identify/none/3797?e=paletz_1.0-ch12_s02,Senators should possess a certain amount of wealth (Incorrect),Elections have become more competitive (Correct),Senators should have a good credit rating,Security deposit for elections have increased over a period,Senators have to appoint secretaries at their own cost,
12,10,Which of the following is a key difference between the Senate and the House of Representatives?,http://catalog.flatworldknowledge.com/bookhub/identify/none/3797?e=paletz_1.0-ch12_s02,The number of members in the Senate Vary every year whereas the number of members in the House remains constant. (Incorrect),The Senate does not rely heavily on hierarchy whereas the House is heavily dependent on hierarchy. (Correct),The Senate is more rule-bound and operates more systematically and predictably than the House of Representatives.,Members of the House serve long terms and get to know their colleagues better than the senators.,"Unlike the senators, the members of the House can pursue a fast track to leadership and have increased public visibility early in their careers.",
12,11,Party votes occur when a majority of members of one party votes against a majority of members of the opposing party on major legislation.,http://catalog.flatworldknowledge.com/bookhub/identify/none/3797?e=paletz_1.0-ch12_s03,True (Correct),FALSE,,,,
12,12,Which of the following is a major function of a party review committee?,http://catalog.flatworldknowledge.com/bookhub/identify/none/3797?e=paletz_1.0-ch12_s03,Raising funds for elections (Incorrect),Advising government on forming legislations,Conducting election research,Organizing party volunteers,Recommending changes in party organization (Correct),
12,13,Pork barrel spending refers to _____.,http://catalog.flatworldknowledge.com/bookhub/identify/none/3797?e=paletz_1.0-ch12_s03,spending on projects that benefit only a few districts (Correct),the spending that is not for developmental purposes,huge spending on issues that are not beneficial to the public,using illegal means of funding for a public activity,using public money for illegal projects and activities,
12,14,Leaders from each party who coordinate legislative initiatives are called _____.,http://catalog.flatworldknowledge.com/bookhub/identify/none/3797?e=paletz_1.0-ch12_s04,legislative leaders (Incorrect),party speakers,floor leaders (Correct),party whips,opinion leaders,
12,15,Whips are _____.,http://catalog.flatworldknowledge.com/bookhub/identify/none/3797?e=paletz_1.0-ch12_s04,neutral members who control proceedings in the House (Incorrect),the top-ranked members of the House and the Senate,presiding officers of the House and the Senate,members who promote party unity in voting (Correct),members with significant power to control the legislative agenda,
12,16,Which of the following is a valid observation about the Speaker of the House?,http://catalog.flatworldknowledge.com/bookhub/identify/none/3797?e=paletz_1.0-ch12_s04,The Speaker is first in succession to the presidency. (Incorrect),The Speaker’s primary duties include initiating bills in the House.,The Speaker cannot control the legislative agenda in the House.,The Speaker is not authorized to sign the bills passed by the House.,The Speaker of the House is at the top of the leadership hierarchy. (Correct),
12,17,The House majority leader _____.,http://catalog.flatworldknowledge.com/bookhub/identify/none/3797?e=paletz_1.0-ch12_s04,is the only officer of the House mentioned specifically in the Constitution (Incorrect),appoints members to select and conference committees,is second to the Speaker in the majority party hierarchy (Correct),is second in succession to the presidency,appoints members of the Rules Committee who can be relied on to do his or her bidding,
12,18,The head of the party with the fewest members in the House who conveys the minority party’s positions on issues and courts the press is called the _____.,http://catalog.flatworldknowledge.com/bookhub/identify/none/3797?e=paletz_1.0-ch12_s04,House minority leader (Correct),Major floor leader,Leader of opposition,Chief whip,Opinion leader,
12,19,Who convenes the floor action in the Senate?,http://catalog.flatworldknowledge.com/bookhub/identify/none/3797?e=paletz_1.0-ch12_s05,The presiding officer (Correct),Senate majority leader,President pro tempore,The Speaker,Attorney General,
12,20,Who is the second-highest ranking member of the Senate after the vice president?,http://catalog.flatworldknowledge.com/bookhub/identify/none/3797?e=paletz_1.0-ch12_s05,Senate majority leader (Incorrect),Secretary of the Interior,The Speaker,President pro tempore (Correct),Attorney General,
12,21,_____ is responsible for managing the Senate’s business and managing the floor.,http://catalog.flatworldknowledge.com/bookhub/identify/none/3797?e=paletz_1.0-ch12_s05,Secretary of the Interior (Incorrect),The Presiding officer,Senate majority leader,Attorney General,President pro tempore (Correct),
12,22,Congressional committees do not conduct investigations publically.,http://catalog.flatworldknowledge.com/bookhub/identify/none/3797?e=paletz_1.0-ch12_s06,True (Incorrect),False (Correct),,,,
12,23,Which of the following terms refer to the permanent legislative committees in the House and Senate?,http://catalog.flatworldknowledge.com/bookhub/identify/none/3797?e=paletz_1.0-ch12_s06,Standing committees (Correct),Select committees,Limit committees,Special committees,Supreme committees,
12,24,_____ committees are composed of members of the House and Senate and handle matters that require joint jurisdiction.,http://catalog.flatworldknowledge.com/bookhub/identify/none/3797?e=paletz_1.0-ch12_s06,Judicial (Incorrect),Standing,Select,Special,Joint (Correct),
12,25,"In the House, bills must go the Rules Committee before reaching the floor.",http://catalog.flatworldknowledge.com/bookhub/identify/none/3797?e=paletz_1.0-ch12_s07,True (Correct),FALSE,,,,
12,26,The docket refers to the _____.,http://catalog.flatworldknowledge.com/bookhub/identify/none/3797?e=paletz_1.0-ch12_s07,list of legislations that control the congress (Incorrect),schedule outlining the congressional workload. (Correct),legislative agenda used for governance,list of powers that the secretaries of state possess,bills that establish the level of funding for a program.,
12,27,Authorization bills are bills that _____.,http://catalog.flatworldknowledge.com/bookhub/identify/none/3797?e=paletz_1.0-ch12_s07,provide the funding for a department (Incorrect),are passed without the approval of the president,establish the level of funding for a program (Correct),provide the funding for an agency program,are initiated by the presiding officer of the senate,
12,28,A member of Congress who actively seeks press attention is called a work force.,http://catalog.flatworldknowledge.com/bookhub/identify/none/3797?e=paletz_1.0-ch12_s08,True (Incorrect),False (Correct),,,,
12,29,A show horse is a member of congress who _____.,http://catalog.flatworldknowledge.com/bookhub/identify/none/3797?e=paletz_1.0-ch12_s08,introduce a private bill in the Congress (Incorrect),actively seek press attention (Correct),works behind the scenes,gets a resolution passed in Congress,initiates a bill in the Congress,
12,30,Which of the following refers to the ability of Congress members to post mail without cost?,http://catalog.flatworldknowledge.com/bookhub/identify/none/3797?e=paletz_1.0-ch12_s08,Constituent privilege (Incorrect),Cloture privilege,Franking privilege (Correct),Filibuster privilege,Sponsored privilege,
12,31,Tactics used by members to work behind the scenes in Congress to forge coalitions while avoiding press scrutiny are called outsider strategies.,http://catalog.flatworldknowledge.com/bookhub/identify/none/3797?e=paletz_1.0-ch12_s09,True (Incorrect),False (Correct),,,,
12,32,What are sunshine laws?,http://catalog.flatworldknowledge.com/bookhub/identify/none/3797?e=paletz_1.0-ch12_s09,Laws that are passed by the congress and vetoed by the president (Incorrect),Laws that are passed by the congress with the approval from the president,Laws that are formed to favor governmental policies,Laws passed by Congress to open hearings to the public and the press (Correct),Laws that are used by the congress when ruling on policy issues,
12,33,Which of the following refers to the tactics used by members to work behind the scenes in Congress to forge coalitions while avoiding press scrutiny?,http://catalog.flatworldknowledge.com/bookhub/identify/none/3797?e=paletz_1.0-ch12_s09,Lobbying strategies (Incorrect),Influence strategies,Outsider strategies,Nominal strategies,Insider strategies (Correct),
13,1,President’s power to pardon is the only one power that cannot be limited by other branches.,http://catalog.flatworldknowledge.com/bookhub/identify/none/3797?e=paletz_1.0-ch13_s01,True (Correct),FALSE,,,,
13,2,President cannot make judicial or executive appointments without Senate confirmation,http://catalog.flatworldknowledge.com/bookhub/identify/none/3797?e=paletz_1.0-ch13_s01,True (Incorrect),False (Correct),,,,
13,3,Inherent powers refer to the presidential powers that are explicitly stated in the constitution.,http://catalog.flatworldknowledge.com/bookhub/identify/none/3797?e=paletz_1.0-ch13_s01,True (Incorrect),False (Correct),,,,
13,4,Which of the following powers that the president of United States exercise cannot be limited by the other branches of the constitution?,http://catalog.flatworldknowledge.com/bookhub/identify/none/3797?e=paletz_1.0-ch13_s01,Power to veto legislation (Incorrect),Power to pardon offences (Correct),Power to exercise pocket veto,Power to make treaties,Power to be the commander in chief of armed forces,
13,5,Who is the United States of America’s Chief diplomat?,http://catalog.flatworldknowledge.com/bookhub/identify/none/3797?e=paletz_1.0-ch13_s01,President pro tempore of the Senate (Incorrect),Speaker of the House,Secretary of State,Attorney General,President of the United States (Correct),
13,6,Which of the following is a valid observation of impeachment?,http://catalog.flatworldknowledge.com/bookhub/identify/none/3797?e=paletz_1.0-ch13_s01,Only the Senate can initiate a motion of impeachment. (Incorrect),President can be removed if a simple majority in the House votes to impeach the president.,A two-thirds vote by the Senate is necessary for conviction of the president. (Correct),The president himself can initiate a motion of impeachment against him.,Impeachment can be initiated only if it obtains a two-thirds vote in the House.,
13,7,Inherent powers _____.,http://catalog.flatworldknowledge.com/bookhub/identify/none/3797?e=paletz_1.0-ch13_s01,are powers originated by passing executive orders (Incorrect),powers available to the state governments,imply prerogatives claimed by presidents (Correct),are powers that are explicitly stated,are powers that are formally approved by the House of Representatives,
13,8,Which of the following is a valid observation about the executive offices of the president?,http://catalog.flatworldknowledge.com/bookhub/identify/none/3797?e=paletz_1.0-ch13_s01,It encompasses presidential staff agencies. (Correct),Executive office positions do not require confirmations from Senate.,It contains the president’s personal staff of assistants and advisors.,Executive offices are exempt from Congress’s purview.,Presidents have a free hand with the structure of the executive offices,
13,9,Which of the following agencies is included in the executive office of the president?,http://catalog.flatworldknowledge.com/bookhub/identify/none/3797?e=paletz_1.0-ch13_s01,Counselor to the President (Incorrect),National Security Council (Correct),Advisor to the president,Office of the Chief of Staff,Office of the First Lady,
13,10,The White House office contains _____.,http://catalog.flatworldknowledge.com/bookhub/identify/none/3797?e=paletz_1.0-ch13_s01,agencies formed by law (Incorrect),agencies controlled by the Senate,offices of management and budget,president’s personal staff (Correct),offices controlled by the House,
13,11,Which of the following agencies is encompassed by the White House office?,http://catalog.flatworldknowledge.com/bookhub/identify/none/3797?e=paletz_1.0-ch13_s01,Office of Administration (Incorrect),National Security Council,Office of the Vice President,Office of Management and Budget,Office of the first lady (Correct),
13,12,The president can introduce bills in the Congress.,http://catalog.flatworldknowledge.com/bookhub/identify/none/3797?e=paletz_1.0-ch13_s02,True (Incorrect),False (Correct),,,,
13,13,The president has the power to veto certain parts of a bill and retain the rest.,http://catalog.flatworldknowledge.com/bookhub/identify/none/3797?e=paletz_1.0-ch13_s02,True (Incorrect),False (Correct),,,,
13,14,The president claims the right to ignore or refuse to enforce laws in a signing statement.,http://catalog.flatworldknowledge.com/bookhub/identify/none/3797?e=paletz_1.0-ch13_s02,True (Correct),FALSE,,,,
13,15,Which of the following is a characteristic of a divided government?,http://catalog.flatworldknowledge.com/bookhub/identify/none/3797?e=paletz_1.0-ch13_s02,President is not favored by a subsection of his party. (Correct),President’s party has a two-thirds majority in the House of Representatives.,President’s party does not have majority in the congress.,President’s party has a two-thirds majority in the Senate.,President uses veto power to overrule a bill initiated by the House.,
13,16,What is the major function of legislative liaison officers?,http://catalog.flatworldknowledge.com/bookhub/identify/none/3797?e=paletz_1.0-ch13_s02,Connecting the two chambers of the Congress (Incorrect),Preventing lobbying political parties and other groups,Interacting and lobbying with the members of the congress (Correct),Interacting with the media to represent the House of Representatives,Presenting the views of judiciary in the Congress,
13,17,Which of the following statements describes a veto?,http://catalog.flatworldknowledge.com/bookhub/identify/none/3797?e=paletz_1.0-ch13_s02,President returning a bill with objections (Correct),Rejection of a bill by the House of Representatives,Rejection of a bill by the Senate,Failure to obtain two-thirds majority in the House,Rejection of a bill by the department of finance,
13,18,What is the minimum requirement to override a veto by the president?,http://catalog.flatworldknowledge.com/bookhub/identify/none/3797?e=paletz_1.0-ch13_s02,Simple majority in the House of Representatives (Incorrect),Simple majority in the Senate,Two-thirds majorities in each chamber. (Correct),Support from the majority of the state legislatures,Line-item vetoes from the governors of all states,
13,19,Which of the following is a major facet of a Line-item veto?,http://catalog.flatworldknowledge.com/bookhub/identify/none/3797?e=paletz_1.0-ch13_s02,It involves complete rejection of a bill (Incorrect),It cannot be overridden by the Congress,It is an exclusive power available to the President,It allows partial rejection of bills (Correct),It is not applicable to state legislatures,
13,20,Executive orders are _____.,http://catalog.flatworldknowledge.com/bookhub/identify/none/3797?e=paletz_1.0-ch13_s02,parts of the bill of rights (Incorrect),line-item vetoes issued by the governors,vetoes issued by the president of the United States,presidential directives to administrators,directives to members of the judicial branch (Correct),
13,21,Which of the following refers to the rally phenomenon?,http://catalog.flatworldknowledge.com/bookhub/identify/none/3797?e=paletz_1.0-ch13_s02,Increase in US revenues during periods of international turmoil and crises (Incorrect),Increase in US revenues as a result of collective global growth factors,Increase in the value of a company’s shares due to a positive governmental move,Increase in the popularity of a political party during the tenure of a president,Increase in president’s approval rating during periods of international tension (Correct),
13,22,Gaggle refers to a meeting that is neither formal nor public.,http://catalog.flatworldknowledge.com/bookhub/identify/none/3797?e=paletz_1.0-ch13_s03,True (Correct),FALSE,,,,
13,23,Which of the following refers to promoting the president’s policies and goals?,http://catalog.flatworldknowledge.com/bookhub/identify/none/3797?e=paletz_1.0-ch13_s03,Advocating (Correct),Explaining,Defending,Shielding,Coordinating,
13,24,One of the assistants of the president is addressing the people through a national TV channel. He is responding to the criticisms against a recent executive order by the president. The assistant is engaged in _____.,http://catalog.flatworldknowledge.com/bookhub/identify/none/3797?e=paletz_1.0-ch13_s03,advocating (Incorrect),explaining,defending (Correct),amplifying,coordinating,
13,25,Line of the day _____.,http://catalog.flatworldknowledge.com/bookhub/identify/none/3797?e=paletz_1.0-ch13_s03,is the issue or stance designated by the White House (Correct),refers to a communication strategy by the executive office,is used by the Senate to give directions to the executive branch of the constitution,refers to the private communication between the various branches of legislature,is a strategy used by the White House to defend the president during crises,
14,1,The federal bureaucracy is explicitly laid out in the Constitution.,http://catalog.flatworldknowledge.com/bookhub/identify/none/3797?e=paletz_1.0-ch14_s01,True (Incorrect),False (Correct),,,,
14,2,Cabinet departments are the major administrative units responsible for specified broad areas of government operations.,http://catalog.flatworldknowledge.com/bookhub/identify/none/3797?e=paletz_1.0-ch14_s01,True (Correct),FALSE,,,,
14,3,Patronage refers to the distribution of governmental jobs and grants to members and allies of the political party in power.,http://catalog.flatworldknowledge.com/bookhub/identify/none/3797?e=paletz_1.0-ch14_s01,True (Correct),FALSE,,,,
14,4,Which of the following is a characteristic of the ideal form of bureaucracy?,http://catalog.flatworldknowledge.com/bookhub/identify/none/3797?e=paletz_1.0-ch14_s01,Generalized offices with undefined jurisdictions (Incorrect),Parallel organizational structures,Lack of a definite chain of command,Impersonal reliance on written rules (Correct),High arbitrary variation from one case to the next,
14,5,How did the federal bureaucracy evolve?,http://catalog.flatworldknowledge.com/bookhub/identify/none/3797?e=paletz_1.0-ch14_s01,It was laid out by the Articles of the Constitution. (Incorrect),It evolved by an amendment to the constitution in the 20th century.,It was formed by the provisions in the Bill of Rights.,It was established by an executive order by Thomas Jefferson.,It evolved by the gradual accretion of agencies and tasks. (Correct),
14,6,The civil service refers to the _____.,http://catalog.flatworldknowledge.com/bookhub/identify/none/3797?e=paletz_1.0-ch14_s01,part-time employees working for the federal government (Incorrect),the actions of the Office of Management and Budget and related agencies,administrative workforce employed by the federal government (Correct),people who engage in social work without accepting any compensation,the actions of the national security council and related agencies,
14,7,Why did Andrew Jackson make political patronage a matter of principle?,http://catalog.flatworldknowledge.com/bookhub/identify/none/3797?e=paletz_1.0-ch14_s01,He wanted to ensure the participation of people from various political ideologies in Bureaucracy. (Incorrect),He wanted to ensure that federal workers were accountable to the executive branch. (Correct),He wanted to reduce the power entrusted on the executive branch of the constitution.,He wanted to reduce the power entrusted on the judicial branch of the constitution.,He wanted to reduce president’s interference on matter concerning public policies.,
14,8,Which of the following refers to the practice of patronage?,http://catalog.flatworldknowledge.com/bookhub/identify/none/3797?e=paletz_1.0-ch14_s01,Replacing all civil servants with party faithful (Correct),Using lobbying to influence public policies,Influencing judiciary to get decisions in one’s favor,Using presidential power to veto bills passed by the congress,Refusing to enforce laws in a signing statement,
14,9,Which of the following is a valid observation of the Pendleton Act of 1883?,http://catalog.flatworldknowledge.com/bookhub/identify/none/3797?e=paletz_1.0-ch14_s01,It replaced patronage system with a merit system. (Incorrect),It made political appointments to public jobs illegal.,It abolished the merit system by legalizing patronage system.,It sorted federal employees into merit and patronage categories. (Correct),It allowed the president to place patronage above merit.,
14,10,Which of the following statements is true about cabinet departments?,http://catalog.flatworldknowledge.com/bookhub/identify/none/3797?e=paletz_1.0-ch14_s01,They are administrative units. (Correct),They are units created by executive orders.,They are agencies of the white house.,They are units created by the president of United States.,They are independent executive agencies.,
14,11,Which of the following is an independent executive agency?,http://catalog.flatworldknowledge.com/bookhub/identify/none/3797?e=paletz_1.0-ch14_s01,National Park Service (Incorrect),The Bureau of Indian Affairs,National Aeronautics and Space Administration (Correct),US Geological Survey,The Bureau of Foreign Affairs,
14,12,Any rule listed in the Federal Register has the status and force of law.,http://catalog.flatworldknowledge.com/bookhub/identify/none/3797?e=paletz_1.0-ch14_s02,True (Correct),FALSE,,,,
14,13,Congress sets agency budgets and conditions for how funds must be used.,http://catalog.flatworldknowledge.com/bookhub/identify/none/3797?e=paletz_1.0-ch14_s02,True (Correct),FALSE,,,,
14,14,Congressional oversight refers to the erroneous decisions that the congress make.,http://catalog.flatworldknowledge.com/bookhub/identify/none/3797?e=paletz_1.0-ch14_s02,True (Incorrect),False (Correct),,,,
14,15,Which of the following is the government publication that prints all rules and decision made by agencies?,http://catalog.flatworldknowledge.com/bookhub/identify/none/3797?e=paletz_1.0-ch14_s02,Bill of Rights (Incorrect),Official Journal of the United States,Federal Depository Library,Federal Register (Correct),Senate Committee,
